negocio,categoria,estrellas,reseñas,ubicacion,diagnostico,oportunidad,precio_estimado,prioridad,mensaje_propuesto
"Los Primos","Cocina del Norte de México",4.8,4,"García Centro","Solo redes sociales, sin sitio web oficial","Sitio web de 1 página con menú digital + WhatsApp","$15,000 - $25,000","URGENTE","Hola, soy desarrollador web local de García. He visto en Yelp que Los Primos tiene excelentes reseñas (4.8 estrellas) y ofrece comida regiomontana tradicional. Noté que no tienen un sitio web propio. Puedo crearles una página profesional con menú digital y WhatsApp para que más clientes los encuentren. ¿Te interesa saber más?"
"Checo's","Taquería",4.4,5,"García","Sin presencia digital significativa","Landing page simple con menú de tacos + WhatsApp","$15,000 - $30,000","URGENTE","Hola, soy desarrollador web local de García. He visto que Checo's tiene excelentes reseñas en Yelp. Noté que no tienen sitio web ni menú visible online. Tengo una propuesta especial para taquerías: página web con menú de tacos y botón de WhatsApp por $15,000 MXN. ¿Te interesa saber más?"
"Galo Kitchen","Fonda",4.7,6,"García","Sitio básico, necesita mejoras","Rediseño web con galería + SEO local","$10,000 - $20,000","MEDIA","Hola, soy desarrollador web local de García. He visto que Galo Kitchen tiene excelentes reseñas (4.7 estrellas) y ofrece comida de calidad. Tengo una propuesta para mejorar su presencia digital con un sitio web profesional y menú digital. ¿Te interesa saber más?"
"Leo's","Taquería",5.0,5,"García","Nueva taquería, sin presencia digital","Landing page desde cero + posicionamiento","$10,000 - $20,000","MEDIA","Hola, soy desarrollador web local de García. He visto que Leo's tiene 5 estrellas en Yelp - ¡felicidades! Noté que no tienen sitio web. Puedo crearles una página profesional desde cero con menú digital y WhatsApp. ¿Te interesa saber más?"
"Cien 28","Antojitos / Cocina mexicana",4.4,5,"García","Solo redes sociales","Sitio web premium para restaurante $$$","$5,000 - $10,000","BAJO","Hola, soy desarrollador web local. He visto que Cien 28 tiene excelentes reseñas en Yelp. Tengo una propuesta especial para restaurantes de la zona. ¿Te interesa saber más?"
"Icamole","Cocina del Norte de México",4.0,1,"García","Nueva ubicación, sin web","Landing page básica para nuevo negocio","$5,000 - $10,000","BAJO","Hola, soy desarrollador web local de García. Vi que Icamole está en la plaza principal - excelente ubicación. Noté que no tienen sitio web. Tengo una propuesta especial para nuevos negocios. ¿Te interesa saber más?"